INFO 06-17 12:30:10 [__init__.py:239] Automatically detected platform cuda.
2025-06-17 12:30:26,421 - __main__ - INFO - === STARTING COMPREHENSIVE TP INCONSISTENCY DEBUG ===
2025-06-17 12:30:26,774 - __main__ - INFO - === TOKENIZATION DEBUGGING ===
2025-06-17 12:30:26,785 - __main__ - INFO - Sequence 'Paris':
2025-06-17 12:30:26,785 - __main__ - INFO -   Normal: [40313] -> 'Paris'
2025-06-17 12:30:26,785 - __main__ - INFO -   With space: [6342] -> ' Paris'
2025-06-17 12:30:26,785 - __main__ - INFO - 
==================================================
2025-06-17 12:30:26,785 - __main__ - INFO - DEBUGGING WITH TENSOR_PARALLEL_SIZE = 1
2025-06-17 12:30:26,785 - __main__ - INFO - ==================================================
2025-06-17 12:30:26,785 - __main__ - INFO - Initializing LLM with TP=1
INFO 06-17 12:30:27 [config.py:2700] Downcasting torch.float32 to torch.float16.
INFO 06-17 12:30:34 [config.py:600] This model supports multiple tasks: {'embed', 'generate', 'classify', 'score', 'reward'}. Defaulting to 'generate'.
INFO 06-17 12:30:34 [config.py:1780] Chunked prefill is enabled with max_num_batched_tokens=8192.
huggingface/tokenizers: The current process just got forked, after parallelism has already been used. Disabling parallelism to avoid deadlocks...
To disable this warning, you can either:
	- Avoid using `tokenizers` before the fork if possible
	- Explicitly set the environment variable TOKENIZERS_PARALLELISM=(true | false)
INFO 06-17 12:30:36 [core.py:61] Initializing a V1 LLM engine (v0.8.3) with config: model='gpt2', speculative_config=None, tokenizer='gpt2', skip_tokenizer_init=False, tokenizer_mode=auto, revision=None, override_neuron_config=None, tokenizer_revision=None, trust_remote_code=False, dtype=torch.float16, max_seq_len=1024, download_dir=None, load_format=auto, tensor_parallel_size=1, pipeline_parallel_size=1, disable_custom_all_reduce=False, quantization=None, enforce_eager=False, kv_cache_dtype=auto,  device_config=cuda, decoding_config=DecodingConfig(guided_decoding_backend='xgrammar', reasoning_backend=None), observability_config=ObservabilityConfig(show_hidden_metrics=False, otlp_traces_endpoint=None, collect_model_forward_time=False, collect_model_execute_time=False), seed=None, served_model_name=gpt2, num_scheduler_steps=1, multi_step_stream_outputs=True, enable_prefix_caching=True, chunked_prefill_enabled=True, use_async_output_proc=True, disable_mm_preprocessor_cache=False, mm_processor_kwargs=None, pooler_config=None, compilation_config={"level":3,"custom_ops":["none"],"splitting_ops":["vllm.unified_attention","vllm.unified_attention_with_output"],"use_inductor":true,"compile_sizes":[],"use_cudagraph":true,"cudagraph_num_of_warmups":1,"cudagraph_capture_sizes":[512,504,496,488,480,472,464,456,448,440,432,424,416,408,400,392,384,376,368,360,352,344,336,328,320,312,304,296,288,280,272,264,256,248,240,232,224,216,208,200,192,184,176,168,160,152,144,136,128,120,112,104,96,88,80,72,64,56,48,40,32,24,16,8,4,2,1],"max_capture_size":512}
WARNING 06-17 12:30:36 [utils.py:2413] Methods determine_num_available_blocks,device_config,get_cache_block_size_bytes,initialize_cache not implemented in <vllm.v1.worker.gpu_worker.Worker object at 0x7f5e94c06b30>
[W617 12:30:47.654005344 socket.cpp:204] [c10d] The hostname of the client socket cannot be retrieved. err=-3
INFO 06-17 12:30:48 [parallel_state.py:957] rank 0 in world size 1 is assigned as DP rank 0, PP rank 0, TP rank 0
INFO 06-17 12:30:48 [cuda.py:221] Using Flash Attention backend on V1 engine.
INFO 06-17 12:30:48 [gpu_model_runner.py:1258] Starting to load model gpt2...
WARNING 06-17 12:30:48 [topk_topp_sampler.py:69] FlashInfer is not available. Falling back to the PyTorch-native implementation of top-p & top-k sampling. For the best performance, please install FlashInfer.
INFO 06-17 12:30:48 [weight_utils.py:265] Using model weights format ['*.safetensors']
INFO 06-17 12:30:48 [weight_utils.py:315] No model.safetensors.index.json found in remote.
Loading safetensors checkpoint shards:   0% Completed | 0/1 [00:00<?, ?it/s]
Loading safetensors checkpoint shards: 100% Completed | 1/1 [00:00<00:00,  5.79it/s]
Loading safetensors checkpoint shards: 100% Completed | 1/1 [00:00<00:00,  5.78it/s]

INFO 06-17 12:30:48 [loader.py:447] Loading weights took 0.19 seconds
INFO 06-17 12:30:48 [gpu_model_runner.py:1273] Model loading took 0.2378 GiB and 0.623795 seconds
INFO 06-17 12:30:51 [backends.py:416] Using cache directory: /home/jjl7137/.cache/vllm/torch_compile_cache/f333c00c2f/rank_0_0 for vLLM's torch.compile
INFO 06-17 12:30:51 [backends.py:426] Dynamo bytecode transform time: 2.14 s
INFO 06-17 12:30:51 [backends.py:115] Directly load the compiled graph for shape None from the cache
INFO 06-17 12:30:52 [monitor.py:33] torch.compile takes 2.14 s in total
INFO 06-17 12:30:53 [kv_cache_utils.py:578] GPU KV cache size: 548,864 tokens
INFO 06-17 12:30:53 [kv_cache_utils.py:581] Maximum concurrency for 1,024 tokens per request: 536.00x
INFO 06-17 12:31:07 [gpu_model_runner.py:1608] Graph capturing finished in 14 secs, took 0.20 GiB
INFO 06-17 12:31:07 [core.py:162] init engine (profile, create kv cache, warmup model) took 18.41 seconds
2025-06-17 12:31:07,358 - __main__ - INFO - === vLLM LOGPROBS DEBUGGING (TP=1) ===
2025-06-17 12:31:07,358 - __main__ - INFO - Running vLLM generation with TP=1
Processed prompts:   0%|          | 0/1 [00:00<?, ?it/s, est. speed input: 0.00 toks/s, output: 0.00 toks/s]Processed prompts: 100%|██████████| 1/1 [00:00<00:00,  4.44it/s, est. speed input: 22.21 toks/s, output: 22.20 toks/s]Processed prompts: 100%|██████████| 1/1 [00:00<00:00,  4.43it/s, est. speed input: 22.21 toks/s, output: 22.20 toks/s]
2025-06-17 12:31:07,595 - __main__ - INFO - Detailed logprobs for TP=1:
2025-06-17 12:31:07,595 - __main__ - INFO - Prompt: 'The capital of France is'
2025-06-17 12:31:07,596 - __main__ - INFO -   Output 0: ' the capital of the French'
2025-06-17 12:31:07,596 - __main__ - INFO -   Token IDs: [262, 3139, 286, 262, 4141]
2025-06-17 12:31:07,596 - __main__ - INFO -     Position 0:
2025-06-17 12:31:07,596 - __main__ - INFO -       Token 262 (' the'): -2.475304
2025-06-17 12:31:07,596 - __main__ - INFO -       Token 783 (' now'): -3.037804
2025-06-17 12:31:07,596 - __main__ - INFO -       Token 257 (' a'): -3.100304
2025-06-17 12:31:07,596 - __main__ - INFO -       Token 6342 (' Paris'): -3.412804
2025-06-17 12:31:07,596 - __main__ - INFO -       Token 4881 (' France'): -3.412804
2025-06-17 12:31:07,596 - __main__ - INFO -     Position 1:
2025-06-17 12:31:07,596 - __main__ - INFO -       Token 3139 (' capital'): -1.752676
2025-06-17 12:31:07,596 - __main__ - INFO -       Token 1748 (' city'): -3.377676
2025-06-17 12:31:07,596 - __main__ - INFO -       Token 4141 (' French'): -3.752676
2025-06-17 12:31:07,596 - __main__ - INFO -       Token 4387 (' largest'): -3.815176
2025-06-17 12:31:07,596 - __main__ - INFO -       Token 749 (' most'): -3.815176
2025-06-17 12:31:07,597 - __main__ - INFO -     Position 2:
2025-06-17 12:31:07,597 - __main__ - INFO -       Token 286 (' of'): -0.076023
2025-06-17 12:31:07,597 - __main__ - INFO -       Token 11 (','): -3.951023
2025-06-17 12:31:07,597 - __main__ - INFO -       Token 1748 (' city'): -4.263524
2025-06-17 12:31:07,597 - __main__ - INFO -       Token 290 (' and'): -5.076024
2025-06-17 12:31:07,597 - __main__ - INFO -       Token 13 ('.'): -5.169774
2025-06-17 12:31:07,597 - __main__ - INFO -     Position 3:
2025-06-17 12:31:07,597 - __main__ - INFO -       Token 262 (' the'): -1.244771
2025-06-17 12:31:07,597 - __main__ - INFO -       Token 4881 (' France'): -1.619771
2025-06-17 12:31:07,597 - __main__ - INFO -       Token 257 (' a'): -2.869771
2025-06-17 12:31:07,597 - __main__ - INFO -       Token 2031 (' Europe'): -4.244771
2025-06-17 12:31:07,597 - __main__ - INFO -       Token 4141 (' French'): -4.369771
2025-06-17 12:31:07,597 - __main__ - INFO -     Position 4:
2025-06-17 12:31:07,597 - __main__ - INFO -       Token 4141 (' French'): -1.967612
2025-06-17 12:31:07,598 - __main__ - INFO -       Token 2066 (' Republic'): -2.967612
2025-06-17 12:31:07,598 - __main__ - INFO -       Token 3427 (' European'): -3.342612
2025-06-17 12:31:07,598 - __main__ - INFO -       Token 1578 (' United'): -3.342612
2025-06-17 12:31:07,598 - __main__ - INFO -       Token 995 (' world'): -3.467612
2025-06-17 12:31:07,598 - __main__ - INFO - === COMPARING APPROACHES (TP=1) ===
2025-06-17 12:31:07,598 - neuro_manipulation.repe.sequence_prob_vllm_hook - WARNING - Could not detect tensor_parallel_size from engine's parallel_config. Using provided value.
2025-06-17 12:31:07,598 - neuro_manipulation.repe.sequence_prob_vllm_hook - INFO - Initializing SequenceProbVLLMHook with TP size: 1
2025-06-17 12:31:07,598 - neuro_manipulation.repe.sequence_prob_vllm_hook - INFO - Registering LM head hook...
2025-06-17 12:31:07,600 - neuro_manipulation.repe.sequence_prob_vllm_hook - INFO - RPC: Worker Rank 0 registering hook hook_fn_sequence_prob to ParallelLMHead
2025-06-17 12:31:07,600 - neuro_manipulation.repe.sequence_prob_vllm_hook - INFO - RPC: Worker Rank 0 LM head hook registered successfully.
2025-06-17 12:31:07,600 - neuro_manipulation.repe.sequence_prob_vllm_hook - INFO - RPC hook registration results: [True]
2025-06-17 12:31:07,600 - neuro_manipulation.repe.sequence_prob_vllm_hook - INFO - LM head hook registered successfully.
2025-06-17 12:31:07,601 - neuro_manipulation.repe.sequence_prob_vllm_hook - INFO - Setting sequence probability state...
2025-06-17 12:31:07,771 - neuro_manipulation.repe.sequence_prob_vllm_hook - INFO - Running generation to capture logits...
Processed prompts:   0%|          | 0/1 [00:00<?, ?it/s, est. speed input: 0.00 toks/s, output: 0.00 toks/s]Processed prompts: 100%|██████████| 1/1 [00:00<00:00, 93.34it/s, est. speed input: 475.80 toks/s, output: 94.66 toks/s]
2025-06-17 12:31:07,785 - neuro_manipulation.repe.sequence_prob_vllm_hook - INFO - Sequence 'Paris': log_prob=-3.4128, prob=0.032949, perplexity=30.3502
2025-06-17 12:31:07,785 - neuro_manipulation.repe.sequence_prob_vllm_hook - INFO - Resetting sequence probability state...
2025-06-17 12:31:07,802 - __main__ - INFO - vLLM logprobs approach results (TP=1):
2025-06-17 12:31:07,802 - __main__ - INFO -   'Paris': log_prob=-3.41280437
!!! RPC DEBUG: Worker Rank 0 _find_lm_head_module called
!!! RPC DEBUG: Worker Rank 0 model type: <class 'vllm.model_executor.models.gpt2.GPT2LMHeadModel'>
!!! RPC DEBUG: Worker Rank 0 available model attributes: ['training', '_parameters', '_buffers', '_non_persistent_buffers_set', '_backward_pre_hooks', '_backward_hooks', '_is_full_backward_hook', '_forward_hooks', '_forward_hooks_with_kwargs', '_forward_hooks_always_called', '_forward_pre_hooks', '_forward_pre_hooks_with_kwargs', '_state_dict_hooks', '_state_dict_pre_hooks', '_load_state_dict_pre_hooks', '_load_state_dict_post_hooks', '_modules', 'config', 'quant_config', 'make_empty_intermediate_tensors']
!!! RPC DEBUG: Worker Rank 0 found LM head: lm_head - ParallelLMHead
!!! RPC DEBUG: Worker Rank 0 _find_lm_head_module called
!!! RPC DEBUG: Worker Rank 0 model type: <class 'vllm.model_executor.models.gpt2.GPT2LMHeadModel'>
!!! RPC DEBUG: Worker Rank 0 available model attributes: ['training', '_parameters', '_buffers', '_non_persistent_buffers_set', '_backward_pre_hooks', '_backward_hooks', '_is_full_backward_hook', '_forward_hooks', '_forward_hooks_with_kwargs', '_forward_hooks_always_called', '_forward_pre_hooks', '_forward_pre_hooks_with_kwargs', '_state_dict_hooks', '_state_dict_pre_hooks', '_load_state_dict_pre_hooks', '_load_state_dict_post_hooks', '_modules', 'config', 'quant_config', 'make_empty_intermediate_tensors']
!!! RPC DEBUG: Worker Rank 0 found LM head: lm_head - ParallelLMHead
!!! RPC DEBUG: Worker Rank 0 _find_lm_head_module called
!!! RPC DEBUG: Worker Rank 0 model type: <class 'vllm.model_executor.models.gpt2.GPT2LMHeadModel'>
!!! RPC DEBUG: Worker Rank 0 available model attributes: ['training', '_parameters', '_buffers', '_non_persistent_buffers_set', '_backward_pre_hooks', '_backward_hooks', '_is_full_backward_hook', '_forward_hooks', '_forward_hooks_with_kwargs', '_forward_hooks_always_called', '_forward_pre_hooks', '_forward_pre_hooks_with_kwargs', '_state_dict_hooks', '_state_dict_pre_hooks', '_load_state_dict_pre_hooks', '_load_state_dict_post_hooks', '_modules', 'config', 'quant_config', 'make_empty_intermediate_tensors']
!!! RPC DEBUG: Worker Rank 0 found LM head: lm_head - ParallelLMHead
2025-06-17 12:31:08,076 - __main__ - INFO - 
==================================================
2025-06-17 12:31:08,076 - __main__ - INFO - DEBUGGING WITH TENSOR_PARALLEL_SIZE = 2
2025-06-17 12:31:08,076 - __main__ - INFO - ==================================================
2025-06-17 12:31:08,076 - __main__ - INFO - Initializing LLM with TP=2
INFO 06-17 12:31:08 [config.py:2700] Downcasting torch.float32 to torch.float16.
INFO 06-17 12:31:08 [config.py:600] This model supports multiple tasks: {'embed', 'generate', 'classify', 'score', 'reward'}. Defaulting to 'generate'.
INFO 06-17 12:31:08 [config.py:1600] Defaulting to use mp for distributed inference
INFO 06-17 12:31:08 [config.py:1780] Chunked prefill is enabled with max_num_batched_tokens=8192.
huggingface/tokenizers: The current process just got forked, after parallelism has already been used. Disabling parallelism to avoid deadlocks...
To disable this warning, you can either:
	- Avoid using `tokenizers` before the fork if possible
	- Explicitly set the environment variable TOKENIZERS_PARALLELISM=(true | false)
INFO 06-17 12:31:08 [core.py:61] Initializing a V1 LLM engine (v0.8.3) with config: model='gpt2', speculative_config=None, tokenizer='gpt2', skip_tokenizer_init=False, tokenizer_mode=auto, revision=None, override_neuron_config=None, tokenizer_revision=None, trust_remote_code=False, dtype=torch.float16, max_seq_len=1024, download_dir=None, load_format=auto, tensor_parallel_size=2, pipeline_parallel_size=1, disable_custom_all_reduce=False, quantization=None, enforce_eager=False, kv_cache_dtype=auto,  device_config=cuda, decoding_config=DecodingConfig(guided_decoding_backend='xgrammar', reasoning_backend=None), observability_config=ObservabilityConfig(show_hidden_metrics=False, otlp_traces_endpoint=None, collect_model_forward_time=False, collect_model_execute_time=False), seed=None, served_model_name=gpt2, num_scheduler_steps=1, multi_step_stream_outputs=True, enable_prefix_caching=True, chunked_prefill_enabled=True, use_async_output_proc=True, disable_mm_preprocessor_cache=False, mm_processor_kwargs=None, pooler_config=None, compilation_config={"level":3,"custom_ops":["none"],"splitting_ops":["vllm.unified_attention","vllm.unified_attention_with_output"],"use_inductor":true,"compile_sizes":[],"use_cudagraph":true,"cudagraph_num_of_warmups":1,"cudagraph_capture_sizes":[512,504,496,488,480,472,464,456,448,440,432,424,416,408,400,392,384,376,368,360,352,344,336,328,320,312,304,296,288,280,272,264,256,248,240,232,224,216,208,200,192,184,176,168,160,152,144,136,128,120,112,104,96,88,80,72,64,56,48,40,32,24,16,8,4,2,1],"max_capture_size":512}
WARNING 06-17 12:31:08 [multiproc_worker_utils.py:306] Reducing Torch parallelism from 24 threads to 1 to avoid unnecessary CPU contention. Set OMP_NUM_THREADS in the external environment to tune this value as needed.
INFO 06-17 12:31:08 [shm_broadcast.py:264] vLLM message queue communication handle: Handle(local_reader_ranks=[0, 1], buffer_handle=(2, 10485760, 10, 'psm_e6771260'), local_subscribe_addr='ipc:///tmp/c175185e-698b-4227-b469-e87c2a01c880', remote_subscribe_addr=None, remote_addr_ipv6=False)
WARNING 06-17 12:31:09 [utils.py:2413] Methods determine_num_available_blocks,device_config,get_cache_block_size_bytes,initialize_cache not implemented in <vllm.v1.worker.gpu_worker.Worker object at 0x7f5e947212d0>
[1;36m(VllmWorker rank=0 pid=289411)[0;0m INFO 06-17 12:31:09 [shm_broadcast.py:264] vLLM message queue communication handle: Handle(local_reader_ranks=[0], buffer_handle=(1, 10485760, 10, 'psm_8c44318a'), local_subscribe_addr='ipc:///tmp/30ed2624-6d17-44bc-8f75-83a441fe8196', remote_subscribe_addr=None, remote_addr_ipv6=False)
WARNING 06-17 12:31:09 [utils.py:2413] Methods determine_num_available_blocks,device_config,get_cache_block_size_bytes,initialize_cache not implemented in <vllm.v1.worker.gpu_worker.Worker object at 0x7f5e947208e0>
[1;36m(VllmWorker rank=1 pid=289427)[0;0m INFO 06-17 12:31:09 [shm_broadcast.py:264] vLLM message queue communication handle: Handle(local_reader_ranks=[0], buffer_handle=(1, 10485760, 10, 'psm_cf4ce975'), local_subscribe_addr='ipc:///tmp/68a97b93-481b-496d-9dd1-f5994fe1c56e', remote_subscribe_addr=None, remote_addr_ipv6=False)
[1;36m(VllmWorker rank=1 pid=289427)[0;0m INFO 06-17 12:31:10 [utils.py:990] Found nccl from library libnccl.so.2
[1;36m(VllmWorker rank=1 pid=289427)[0;0m INFO 06-17 12:31:10 [pynccl.py:69] vLLM is using nccl==2.21.5
[1;36m(VllmWorker rank=0 pid=289411)[0;0m INFO 06-17 12:31:10 [utils.py:990] Found nccl from library libnccl.so.2
[1;36m(VllmWorker rank=0 pid=289411)[0;0m INFO 06-17 12:31:10 [pynccl.py:69] vLLM is using nccl==2.21.5
[1;36m(VllmWorker rank=0 pid=289411)[0;0m INFO 06-17 12:31:10 [custom_all_reduce_utils.py:244] reading GPU P2P access cache from /home/jjl7137/.cache/vllm/gpu_p2p_access_cache_for_0,1,2,3.json
[1;36m(VllmWorker rank=1 pid=289427)[0;0m INFO 06-17 12:31:10 [custom_all_reduce_utils.py:244] reading GPU P2P access cache from /home/jjl7137/.cache/vllm/gpu_p2p_access_cache_for_0,1,2,3.json
[1;36m(VllmWorker rank=0 pid=289411)[0;0m INFO 06-17 12:31:10 [shm_broadcast.py:264] vLLM message queue communication handle: Handle(local_reader_ranks=[1], buffer_handle=(1, 4194304, 6, 'psm_7750b0f5'), local_subscribe_addr='ipc:///tmp/25f546a5-bab7-45ef-8fb7-053a52991922', remote_subscribe_addr=None, remote_addr_ipv6=False)
[1;36m(VllmWorker rank=1 pid=289427)[0;0m INFO 06-17 12:31:10 [parallel_state.py:957] rank 1 in world size 2 is assigned as DP rank 0, PP rank 0, TP rank 1
[1;36m(VllmWorker rank=0 pid=289411)[0;0m INFO 06-17 12:31:10 [parallel_state.py:957] rank 0 in world size 2 is assigned as DP rank 0, PP rank 0, TP rank 0
[1;36m(VllmWorker rank=1 pid=289427)[0;0m INFO 06-17 12:31:10 [cuda.py:221] Using Flash Attention backend on V1 engine.
[1;36m(VllmWorker rank=0 pid=289411)[0;0m INFO 06-17 12:31:10 [cuda.py:221] Using Flash Attention backend on V1 engine.
[1;36m(VllmWorker rank=1 pid=289427)[0;0m INFO 06-17 12:31:11 [gpu_model_runner.py:1258] Starting to load model gpt2...
[1;36m(VllmWorker rank=0 pid=289411)[0;0m INFO 06-17 12:31:11 [gpu_model_runner.py:1258] Starting to load model gpt2...
[1;36m(VllmWorker rank=0 pid=289411)[0;0m WARNING 06-17 12:31:11 [topk_topp_sampler.py:69] FlashInfer is not available. Falling back to the PyTorch-native implementation of top-p & top-k sampling. For the best performance, please install FlashInfer.
[1;36m(VllmWorker rank=1 pid=289427)[0;0m WARNING 06-17 12:31:11 [topk_topp_sampler.py:69] FlashInfer is not available. Falling back to the PyTorch-native implementation of top-p & top-k sampling. For the best performance, please install FlashInfer.
[1;36m(VllmWorker rank=0 pid=289411)[0;0m INFO 06-17 12:31:11 [weight_utils.py:265] Using model weights format ['*.safetensors']
[1;36m(VllmWorker rank=1 pid=289427)[0;0m INFO 06-17 12:31:11 [weight_utils.py:265] Using model weights format ['*.safetensors']
[1;36m(VllmWorker rank=0 pid=289411)[0;0m INFO 06-17 12:31:11 [weight_utils.py:315] No model.safetensors.index.json found in remote.
[1;36m(VllmWorker rank=0 pid=289411)[0;0m Loading safetensors checkpoint shards:   0% Completed | 0/1 [00:00<?, ?it/s]
[1;36m(VllmWorker rank=1 pid=289427)[0;0m INFO 06-17 12:31:11 [weight_utils.py:315] No model.safetensors.index.json found in remote.
[1;36m(VllmWorker rank=0 pid=289411)[0;0m Loading safetensors checkpoint shards: 100% Completed | 1/1 [00:00<00:00,  5.14it/s]
[1;36m(VllmWorker rank=0 pid=289411)[0;0m Loading safetensors checkpoint shards: 100% Completed | 1/1 [00:00<00:00,  5.13it/s]
[1;36m(VllmWorker rank=0 pid=289411)[0;0m 
[1;36m(VllmWorker rank=0 pid=289411)[0;0m INFO 06-17 12:31:11 [loader.py:447] Loading weights took 0.21 seconds
[1;36m(VllmWorker rank=1 pid=289427)[0;0m INFO 06-17 12:31:11 [loader.py:447] Loading weights took 0.21 seconds
[1;36m(VllmWorker rank=0 pid=289411)[0;0m INFO 06-17 12:31:12 [gpu_model_runner.py:1273] Model loading took 0.1181 GiB and 0.786120 seconds
[1;36m(VllmWorker rank=1 pid=289427)[0;0m INFO 06-17 12:31:12 [gpu_model_runner.py:1273] Model loading took 0.1181 GiB and 0.954002 seconds
[1;36m(VllmWorker rank=1 pid=289427)[0;0m INFO 06-17 12:31:14 [backends.py:416] Using cache directory: /home/jjl7137/.cache/vllm/torch_compile_cache/8445ce933d/rank_1_0 for vLLM's torch.compile
[1;36m(VllmWorker rank=1 pid=289427)[0;0m INFO 06-17 12:31:14 [backends.py:426] Dynamo bytecode transform time: 2.40 s
[1;36m(VllmWorker rank=0 pid=289411)[0;0m INFO 06-17 12:31:14 [backends.py:416] Using cache directory: /home/jjl7137/.cache/vllm/torch_compile_cache/8445ce933d/rank_0_0 for vLLM's torch.compile
[1;36m(VllmWorker rank=0 pid=289411)[0;0m INFO 06-17 12:31:14 [backends.py:426] Dynamo bytecode transform time: 2.43 s
[1;36m(VllmWorker rank=1 pid=289427)[0;0m INFO 06-17 12:31:14 [backends.py:115] Directly load the compiled graph for shape None from the cache
[1;36m(VllmWorker rank=0 pid=289411)[0;0m INFO 06-17 12:31:14 [backends.py:115] Directly load the compiled graph for shape None from the cache
[1;36m(VllmWorker rank=1 pid=289427)[0;0m INFO 06-17 12:31:16 [monitor.py:33] torch.compile takes 2.40 s in total
[1;36m(VllmWorker rank=0 pid=289411)[0;0m INFO 06-17 12:31:16 [monitor.py:33] torch.compile takes 2.43 s in total
INFO 06-17 12:31:16 [kv_cache_utils.py:578] GPU KV cache size: 1,097,504 tokens
INFO 06-17 12:31:16 [kv_cache_utils.py:581] Maximum concurrency for 1,024 tokens per request: 1071.78x
INFO 06-17 12:31:16 [kv_cache_utils.py:578] GPU KV cache size: 1,097,504 tokens
INFO 06-17 12:31:16 [kv_cache_utils.py:581] Maximum concurrency for 1,024 tokens per request: 1071.78x
[1;36m(VllmWorker rank=1 pid=289427)[0;0m INFO 06-17 12:31:31 [custom_all_reduce.py:195] Registering 1675 cuda graph addresses
[1;36m(VllmWorker rank=0 pid=289411)[0;0m INFO 06-17 12:31:32 [custom_all_reduce.py:195] Registering 1675 cuda graph addresses
[1;36m(VllmWorker rank=0 pid=289411)[0;0m INFO 06-17 12:31:32 [gpu_model_runner.py:1608] Graph capturing finished in 15 secs, took 0.20 GiB
[1;36m(VllmWorker rank=1 pid=289427)[0;0m INFO 06-17 12:31:32 [gpu_model_runner.py:1608] Graph capturing finished in 15 secs, took 0.20 GiB
INFO 06-17 12:31:32 [core.py:162] init engine (profile, create kv cache, warmup model) took 20.06 seconds
2025-06-17 12:31:32,632 - __main__ - INFO - === vLLM LOGPROBS DEBUGGING (TP=2) ===
2025-06-17 12:31:32,633 - __main__ - INFO - Running vLLM generation with TP=2
Processed prompts:   0%|          | 0/1 [00:00<?, ?it/s, est. speed input: 0.00 toks/s, output: 0.00 toks/s]Processed prompts: 100%|██████████| 1/1 [00:00<00:00,  6.60it/s, est. speed input: 33.00 toks/s, output: 32.98 toks/s]Processed prompts: 100%|██████████| 1/1 [00:00<00:00,  6.57it/s, est. speed input: 33.00 toks/s, output: 32.98 toks/s]
2025-06-17 12:31:32,792 - __main__ - INFO - Detailed logprobs for TP=2:
2025-06-17 12:31:32,793 - __main__ - INFO - Prompt: 'The capital of France is'
2025-06-17 12:31:32,793 - __main__ - INFO -   Output 0: ' the capital of the French'
2025-06-17 12:31:32,793 - __main__ - INFO -   Token IDs: [262, 3139, 286, 262, 4141]
2025-06-17 12:31:32,793 - __main__ - INFO -     Position 0:
2025-06-17 12:31:32,793 - __main__ - INFO -       Token 262 (' the'): -2.449409
2025-06-17 12:31:32,793 - __main__ - INFO -       Token 783 (' now'): -3.011909
2025-06-17 12:31:32,793 - __main__ - INFO -       Token 257 (' a'): -3.074409
2025-06-17 12:31:32,793 - __main__ - INFO -       Token 6342 (' Paris'): -3.449409
2025-06-17 12:31:32,793 - __main__ - INFO -       Token 4881 (' France'): -3.449409
2025-06-17 12:31:32,793 - __main__ - INFO -     Position 1:
2025-06-17 12:31:32,793 - __main__ - INFO -       Token 3139 (' capital'): -1.756146
2025-06-17 12:31:32,793 - __main__ - INFO -       Token 1748 (' city'): -3.381146
2025-06-17 12:31:32,794 - __main__ - INFO -       Token 4141 (' French'): -3.756146
2025-06-17 12:31:32,794 - __main__ - INFO -       Token 4387 (' largest'): -3.818646
2025-06-17 12:31:32,794 - __main__ - INFO -       Token 749 (' most'): -3.818646
2025-06-17 12:31:32,794 - __main__ - INFO -     Position 2:
2025-06-17 12:31:32,794 - __main__ - INFO -       Token 286 (' of'): -0.074898
2025-06-17 12:31:32,794 - __main__ - INFO -       Token 11 (','): -3.949898
2025-06-17 12:31:32,794 - __main__ - INFO -       Token 1748 (' city'): -4.293648
2025-06-17 12:31:32,794 - __main__ - INFO -       Token 290 (' and'): -5.074898
2025-06-17 12:31:32,794 - __main__ - INFO -       Token 13 ('.'): -5.199898
2025-06-17 12:31:32,794 - __main__ - INFO -     Position 3:
2025-06-17 12:31:32,794 - __main__ - INFO -       Token 262 (' the'): -1.245123
2025-06-17 12:31:32,794 - __main__ - INFO -       Token 4881 (' France'): -1.620123
2025-06-17 12:31:32,794 - __main__ - INFO -       Token 257 (' a'): -2.870123
2025-06-17 12:31:32,794 - __main__ - INFO -       Token 2031 (' Europe'): -4.245123
2025-06-17 12:31:32,794 - __main__ - INFO -       Token 4141 (' French'): -4.370123
2025-06-17 12:31:32,795 - __main__ - INFO -     Position 4:
2025-06-17 12:31:32,795 - __main__ - INFO -       Token 4141 (' French'): -1.990536
2025-06-17 12:31:32,795 - __main__ - INFO -       Token 2066 (' Republic'): -2.928036
2025-06-17 12:31:32,795 - __main__ - INFO -       Token 3427 (' European'): -3.365536
2025-06-17 12:31:32,795 - __main__ - INFO -       Token 1578 (' United'): -3.365536
2025-06-17 12:31:32,795 - __main__ - INFO -       Token 995 (' world'): -3.428036
2025-06-17 12:31:32,795 - __main__ - INFO - === COMPARING APPROACHES (TP=2) ===
2025-06-17 12:31:32,795 - neuro_manipulation.repe.sequence_prob_vllm_hook - WARNING - Could not detect tensor_parallel_size from engine's parallel_config. Using provided value.
2025-06-17 12:31:32,795 - neuro_manipulation.repe.sequence_prob_vllm_hook - INFO - Initializing SequenceProbVLLMHook with TP size: 1
2025-06-17 12:31:32,795 - neuro_manipulation.repe.sequence_prob_vllm_hook - INFO - Registering LM head hook...
[1;36m(VllmWorker rank=1 pid=289427)[0;0m 2025-06-17 12:31:32,797 - neuro_manipulation.repe.sequence_prob_vllm_hook - INFO - RPC: Worker Rank 1 registering hook hook_fn_sequence_prob to ParallelLMHead
[1;36m(VllmWorker rank=0 pid=289411)[0;0m 2025-06-17 12:31:32,797 - neuro_manipulation.repe.sequence_prob_vllm_hook - INFO - RPC: Worker Rank 0 registering hook hook_fn_sequence_prob to ParallelLMHead
[1;36m(VllmWorker rank=1 pid=289427)[0;0m 2025-06-17 12:31:32,797 - neuro_manipulation.repe.sequence_prob_vllm_hook - INFO - RPC: Worker Rank 1 LM head hook registered successfully.
[1;36m(VllmWorker rank=0 pid=289411)[0;0m 2025-06-17 12:31:32,797 - neuro_manipulation.repe.sequence_prob_vllm_hook - INFO - RPC: Worker Rank 0 LM head hook registered successfully.
2025-06-17 12:31:32,798 - neuro_manipulation.repe.sequence_prob_vllm_hook - INFO - RPC hook registration results: [True, True]
2025-06-17 12:31:32,798 - neuro_manipulation.repe.sequence_prob_vllm_hook - INFO - LM head hook registered successfully.
2025-06-17 12:31:32,799 - neuro_manipulation.repe.sequence_prob_vllm_hook - INFO - Setting sequence probability state...
2025-06-17 12:31:33,097 - neuro_manipulation.repe.sequence_prob_vllm_hook - INFO - Running generation to capture logits...
Processed prompts:   0%|          | 0/1 [00:00<?, ?it/s, est. speed input: 0.00 toks/s, output: 0.00 toks/s]Processed prompts: 100%|██████████| 1/1 [00:00<00:00, 92.39it/s, est. speed input: 469.59 toks/s, output: 93.51 toks/s]
2025-06-17 12:31:33,110 - neuro_manipulation.repe.sequence_prob_vllm_hook - INFO - Sequence 'Paris': log_prob=-3.4494, prob=0.031764, perplexity=31.4818
2025-06-17 12:31:33,110 - neuro_manipulation.repe.sequence_prob_vllm_hook - INFO - Resetting sequence probability state...
2025-06-17 12:31:33,118 - __main__ - INFO - vLLM logprobs approach results (TP=2):
2025-06-17 12:31:33,118 - __main__ - INFO -   'Paris': log_prob=-3.44940853
[1;36m(VllmWorker rank=1 pid=289427)[0;0m !!! RPC DEBUG: Worker Rank 1 _find_lm_head_module called
[1;36m(VllmWorker rank=1 pid=289427)[0;0m !!! RPC DEBUG: Worker Rank 1 model type: <class 'vllm.model_executor.models.gpt2.GPT2LMHeadModel'>
[1;36m(VllmWorker rank=1 pid=289427)[0;0m !!! RPC DEBUG: Worker Rank 1 available model attributes: ['training', '_parameters', '_buffers', '_non_persistent_buffers_set', '_backward_pre_hooks', '_backward_hooks', '_is_full_backward_hook', '_forward_hooks', '_forward_hooks_with_kwargs', '_forward_hooks_always_called', '_forward_pre_hooks', '_forward_pre_hooks_with_kwargs', '_state_dict_hooks', '_state_dict_pre_hooks', '_load_state_dict_pre_hooks', '_load_state_dict_post_hooks', '_modules', 'config', 'quant_config', 'make_empty_intermediate_tensors']
[1;36m(VllmWorker rank=1 pid=289427)[0;0m !!! RPC DEBUG: Worker Rank 1 found LM head: lm_head - ParallelLMHead
[1;36m(VllmWorker rank=1 pid=289427)[0;0m !!! RPC DEBUG: Worker Rank 1 _find_lm_head_module called
[1;36m(VllmWorker rank=1 pid=289427)[0;0m !!! RPC DEBUG: Worker Rank 1 model type: <class 'vllm.model_executor.models.gpt2.GPT2LMHeadModel'>
[1;36m(VllmWorker rank=1 pid=289427)[0;0m !!! RPC DEBUG: Worker Rank 1 available model attributes: ['training', '_parameters', '_buffers', '_non_persistent_buffers_set', '_backward_pre_hooks', '_backward_hooks', '_is_full_backward_hook', '_forward_hooks', '_forward_hooks_with_kwargs', '_forward_hooks_always_called', '_forward_pre_hooks', '_forward_pre_hooks_with_kwargs', '_state_dict_hooks', '_state_dict_pre_hooks', '_load_state_dict_pre_hooks', '_load_state_dict_post_hooks', '_modules', 'config', 'quant_config', 'make_empty_intermediate_tensors']
[1;36m(VllmWorker rank=1 pid=289427)[0;0m !!! RPC DEBUG: Worker Rank 1 found LM head: lm_head - ParallelLMHead
[1;36m(VllmWorker rank=1 pid=289427)[0;0m !!! RPC DEBUG: Worker Rank 1 _find_lm_head_module called
[1;36m(VllmWorker rank=1 pid=289427)[0;0m !!! RPC DEBUG: Worker Rank 1 model type: <class 'vllm.model_executor.models.gpt2.GPT2LMHeadModel'>
[1;36m(VllmWorker rank=1 pid=289427)[0;0m !!! RPC DEBUG: Worker Rank 1 available model attributes: ['training', '_parameters', '_buffers', '_non_persistent_buffers_set', '_backward_pre_hooks', '_backward_hooks', '_is_full_backward_hook', '_forward_hooks', '_forward_hooks_with_kwargs', '_forward_hooks_always_called', '_forward_pre_hooks', '_forward_pre_hooks_with_kwargs', '_state_dict_hooks', '_state_dict_pre_hooks', '_load_state_dict_pre_hooks', '_load_state_dict_post_hooks', '_modules', 'config', 'quant_config', 'make_empty_intermediate_tensors']
[1;36m(VllmWorker rank=1 pid=289427)[0;0m !!! RPC DEBUG: Worker Rank 1 found LM head: lm_head - ParallelLMHead
[1;36m(VllmWorker rank=0 pid=289411)[0;0m !!! RPC DEBUG: Worker Rank 0 _find_lm_head_module called
[1;36m(VllmWorker rank=0 pid=289411)[0;0m !!! RPC DEBUG: Worker Rank 0 model type: <class 'vllm.model_executor.models.gpt2.GPT2LMHeadModel'>
[1;36m(VllmWorker rank=0 pid=289411)[0;0m !!! RPC DEBUG: Worker Rank 0 available model attributes: ['training', '_parameters', '_buffers', '_non_persistent_buffers_set', '_backward_pre_hooks', '_backward_hooks', '_is_full_backward_hook', '_forward_hooks', '_forward_hooks_with_kwargs', '_forward_hooks_always_called', '_forward_pre_hooks', '_forward_pre_hooks_with_kwargs', '_state_dict_hooks', '_state_dict_pre_hooks', '_load_state_dict_pre_hooks', '_load_state_dict_post_hooks', '_modules', 'config', 'quant_config', 'make_empty_intermediate_tensors']
[1;36m(VllmWorker rank=0 pid=289411)[0;0m !!! RPC DEBUG: Worker Rank 0 found LM head: lm_head - ParallelLMHead
[1;36m(VllmWorker rank=0 pid=289411)[0;0m !!! RPC DEBUG: Worker Rank 0 _find_lm_head_module called
[1;36m(VllmWorker rank=0 pid=289411)[0;0m !!! RPC DEBUG: Worker Rank 0 model type: <class 'vllm.model_executor.models.gpt2.GPT2LMHeadModel'>
[1;36m(VllmWorker rank=0 pid=289411)[0;0m !!! RPC DEBUG: Worker Rank 0 available model attributes: ['training', '_parameters', '_buffers', '_non_persistent_buffers_set', '_backward_pre_hooks', '_backward_hooks', '_is_full_backward_hook', '_forward_hooks', '_forward_hooks_with_kwargs', '_forward_hooks_always_called', '_forward_pre_hooks', '_forward_pre_hooks_with_kwargs', '_state_dict_hooks', '_state_dict_pre_hooks', '_load_state_dict_pre_hooks', '_load_state_dict_post_hooks', '_modules', 'config', 'quant_config', 'make_empty_intermediate_tensors']
[1;36m(VllmWorker rank=0 pid=289411)[0;0m !!! RPC DEBUG: Worker Rank 0 found LM head: lm_head - ParallelLMHead
[1;36m(VllmWorker rank=0 pid=289411)[0;0m !!! RPC DEBUG: Worker Rank 0 _find_lm_head_module called
[1;36m(VllmWorker rank=0 pid=289411)[0;0m !!! RPC DEBUG: Worker Rank 0 model type: <class 'vllm.model_executor.models.gpt2.GPT2LMHeadModel'>
[1;36m(VllmWorker rank=0 pid=289411)[0;0m !!! RPC DEBUG: Worker Rank 0 available model attributes: ['training', '_parameters', '_buffers', '_non_persistent_buffers_set', '_backward_pre_hooks', '_backward_hooks', '_is_full_backward_hook', '_forward_hooks', '_forward_hooks_with_kwargs', '_forward_hooks_always_called', '_forward_pre_hooks', '_forward_pre_hooks_with_kwargs', '_state_dict_hooks', '_state_dict_pre_hooks', '_load_state_dict_pre_hooks', '_load_state_dict_post_hooks', '_modules', 'config', 'quant_config', 'make_empty_intermediate_tensors']
[1;36m(VllmWorker rank=0 pid=289411)[0;0m !!! RPC DEBUG: Worker Rank 0 found LM head: lm_head - ParallelLMHead
2025-06-17 12:31:34,083 - __main__ - INFO - 
============================================================
2025-06-17 12:31:34,084 - __main__ - INFO - FINAL ANALYSIS OF INCONSISTENCY SOURCES
2025-06-17 12:31:34,084 - __main__ - INFO - ============================================================
2025-06-17 12:31:34,084 - __main__ - INFO - TP=1 log_prob: -3.41280437
2025-06-17 12:31:34,084 - __main__ - INFO - TP=2 log_prob: -3.44940853
2025-06-17 12:31:34,084 - __main__ - INFO - Absolute difference: 0.03660417
2025-06-17 12:31:34,085 - __main__ - INFO - Relative difference: 1.0726%
2025-06-17 12:31:34,085 - __main__ - WARNING - SIGNIFICANT INCONSISTENCY DETECTED!
2025-06-17 12:31:34,085 - __main__ - INFO - Potential causes to investigate:
2025-06-17 12:31:34,085 - __main__ - INFO - 1. vLLM internal logprobs calculation differences
2025-06-17 12:31:34,085 - __main__ - INFO - 2. Numerical precision issues in tensor parallel mode
2025-06-17 12:31:34,085 - __main__ - INFO - 3. Different vocabulary sharding/aggregation
2025-06-17 12:31:34,085 - __main__ - INFO - 4. Token generation order differences

Debugging completed. Check 'tp_inconsistency_debug_results.json' and 'debug_tp_inconsistency.log' for detailed results.
